2017-02359,Amendment,08/05/2019,08/21/2019,08/05/2019,,,,,,,,Dana-Farber Harvard Cancer Center,3456936,NCT03310879,,,,AM 5,INSTITUTIONAL,08/05/2019,,Submission Incomplete -- Missing Documents,"The submitted Consent (clean and tracked) document is expired (exp.date 08/29/2018). The previous Am4 Consent document shows exp.date 08/02/2019.
Please provide unexpired Consent form (clean and tracked).",Interventional,No,On-Hold,08/05/2019,,,,,,Dana-Farber Harvard Cancer Center,08/05/2019,Submission Received Date,08/05/2019,Registry,2,,"Submitted -- not acceptedOn hold since 08/05/2019 , reason: Submission Incomplete -- Missing Documents",08/05/2019,,08/05/2019,,,,,,,,,,,,,,,,,,,,,,,,,,,,,,,,,,,,,,,
2019-05327,Complete,07/31/2019,08/21/2019,08/02/2019,08/01/2019,,,08/02/2019,,,,University of Colorado,58625,16-0701.cc,,,,,INSTITUTIONAL,08/02/2019,,Other,"Per EW# 96199, reach out to request overall trial status confirmation (Current Overall Trial Status shown ?In Review ? 07/22/2019?, ?Approved - 08/17/2016?, and ?Active ? 08/18/2016?).",Interventional,No,On-Hold,08/02/2019,,,,,,University of Colorado,07/31/2019,Ready for Scientific QC Date,08/02/2019,Registry,2,,"Ready for Scientific QCOn hold since 08/02/2019 , reason: Other",07/31/2019,,07/31/2019,08/01/2019,"johnsonj, Julie Johnson",08/01/2019,,,,,,,,,,,,,,,,08/02/2019,"Flumer, Carly",08/02/2019,,,,,,,,,,,,,,,,,,
2019-05302,Complete,07/30/2019,08/21/2019,08/05/2019,08/05/2019,,,,,,,University of Pennsylvania/Abramson Cancer Center,198713,,,,,,INSTITUTIONAL,08/05/2019,,Submission Incomplete -- Missing Documents,"Can you please provide the following documents - Protocol (dated August 11, 2015)
and Consent Form/Study Summary Document (dated August 11, 2015)?",Interventional,No,On-Hold,08/05/2019,,,,,,University of Pennsylvania/Abramson Cancer Center,07/30/2019,Submission Acceptance Date,08/05/2019,Registry,2,,"Ready for Admin ProcessingReady for Scientific ProcessingOn hold since 08/05/2019 , reason: Submission Incomplete -- Missing Documents",07/30/2019,,07/30/2019,08/05/2019,"Otubu, Temisan",08/05/2019,,,,,,,,,,,,,,,,,,,,,,,,,,,,,,,,,,,,
2019-05359,Complete,08/01/2019,08/21/2019,08/01/2019,,,,,,,,Children's Hospital of Philadelphia,198744,,,,,,INSTITUTIONAL,08/01/2019,,Submission Incomplete,Julie Fitzgerald was entered as the PI; however the protocol provided shows the PI as Chani Traube from Weill Cornell. Can you please confirm who the lead organization is for this trial?,Non-interventional,No,On-Hold,08/01/2019,,,,,,University of Pennsylvania/Abramson Cancer Center,08/01/2019,Submission Received Date,08/01/2019,Registry,2,,"Submitted -- not acceptedOn hold since 08/01/2019 , reason: Submission Incomplete",08/01/2019,,08/01/2019,,,,,,,,,,,,,,,,,,,,,,,,,,,,,,,,,,,,,,,
2019-05330,Complete,07/31/2019,08/21/2019,07/31/2019,,,,,,,,Children's Hospital of Philadelphia,198744,NCT02650414,,,,,INSTITUTIONAL,07/31/2019,,Submission Incomplete -- Missing Documents,"Per IRB approval letter dated 9/7/2018 list Protocol (version 7, dated March 30, 2017) and Consent Form/Study Summary Document (version dated March 30, 2017).  Please provide the listed documents.",Interventional,No,On-Hold,07/31/2019,,,,,,University of Pennsylvania/Abramson Cancer Center,07/31/2019,Submission Received Date,07/31/2019,Registry,2,,"Submitted -- not acceptedOn hold since 07/31/2019 , reason: Submission Incomplete -- Missing Documents",07/31/2019,,07/31/2019,,,,,,,,,,,,,,,,,,,,,,,,,,,,,,,,,,,,,,,
