2013-01365,Amendment,08/02/2019,08/16/2019,,08/05/2019,08/05/2019,,08/05/2019,08/05/2019,,,Memorial Sloan Kettering Cancer Center,170680,NCT01908777,,,,13,INSTITUTIONAL,,,,,Interventional,No,Accepted,08/05/2019,,,,,,Memorial Sloan Kettering Cancer Center,08/02/2019,Ready for Administrative QC Date,08/05/2019,,2,,Ready for Admin QC,08/02/2019,,08/02/2019,08/05/2019,"such, Chun-Hui Su",08/05/2019,,,,,,,,,,08/05/2019,"Otubu, Temisan",08/05/2019,,,,08/05/2019,"Chen, Sisi",08/05/2019,08/05/2019,"Appiah, Cecilia",08/05/2019,,,,,,,,,,,,,,,
2019-05422,Complete,08/02/2019,08/16/2019,,08/05/2019,,,,,,,Children's Hospital of Philadelphia,198744,NCT02277639,,,,,INSTITUTIONAL,,,,,Interventional,No,Accepted,08/05/2019,,,,,,University of Pennsylvania/Abramson Cancer Center,08/02/2019,Submission Acceptance Date,08/05/2019,Registry,2,,Ready for Admin ProcessingReady for Scientific Processing,08/02/2019,,08/02/2019,08/05/2019,"such, Chun-Hui Su",08/05/2019,,,,,,,,,,,,,,,,,,,,,,,,,,,,,,,,,,,,
2019-05423,Abbreviated,08/02/2019,08/16/2019,,08/05/2019,08/05/2019,,08/05/2019,08/05/2019,,,Cincinnati Children's Hospital Medical Center,182911,NCT01104025,,,,,INDUSTRIAL,,,,,Interventional,No,Accepted,08/05/2019,,,,,,ClinicalTrials.gov,08/02/2019,Ready for Administrative QC Date,08/05/2019,ClinicalTrials.gov,2,,Ready for Admin QC,08/02/2019,,08/02/2019,08/05/2019,"such, Chun-Hui Su",08/05/2019,,,,,,,,,,08/05/2019,"johnsonj, Julie Johnson",08/05/2019,,,,08/05/2019,"Chen, Sisi",08/05/2019,08/05/2019,"Titanwa, Florence",08/05/2019,,,,,,,,,,,,,,,
2019-05424,Abbreviated,08/02/2019,08/16/2019,,08/05/2019,08/05/2019,,08/05/2019,08/05/2019,,,European Organization for Research and Treatment of Cancer,69348,NCT03345095,,,,,INDUSTRIAL,,,,,Interventional,No,Accepted,08/05/2019,,,,,,ClinicalTrials.gov,08/02/2019,Ready for Administrative QC Date,08/05/2019,ClinicalTrials.gov,2,,Ready for Admin QC,08/02/2019,,08/02/2019,08/05/2019,"such, Chun-Hui Su",08/05/2019,,,,,,,,,,08/05/2019,"johnsonj, Julie Johnson",08/05/2019,,,,08/05/2019,"Chen, Sisi",08/05/2019,08/05/2019,"Titanwa, Florence",08/05/2019,,,,,,,,,,,,,,,
2019-04268,Complete,06/23/2019,08/16/2019,,08/02/2019,,,,,,"Caesar-Johnson, Samantha (SC)",University of Pennsylvania/Abramson Cancer Center,198713,,,,,,INSTITUTIONAL,06/27/2019,08/02/2019,Other,"EW# 95034, submitter provided same incomplete protocol document. Trial removed from automatic on-hold reason code ?Submission Incomplete ? Missing Documents? and placed back on hold as other to request a complete protocol document.",Interventional,No,Accepted,08/02/2019,,,johnsoncs,08/05/2019,,University of Pennsylvania/Abramson Cancer Center,06/23/2019,Submission Acceptance Date,08/02/2019,Registry,2,,Ready for Admin ProcessingReady for Scientific Processing,06/23/2019,,06/23/2019,08/02/2019,"Grinberg, Viktoriya",08/02/2019,,,,,,,,,,,,,,,,,,,,,,,,,,,,,,,,,,,,
2019-04001,Complete,06/13/2019,08/19/2019,06/17/2019,06/13/2019,06/17/2019,,06/17/2019,06/17/2019,,,University of Pennsylvania/Abramson Cancer Center,198713,NCT01484925,,,,,INSTITUTIONAL,06/17/2019,,Other,Trial placed on hold to confirm lead organization - per EW # 94686 Columbia is the lead org for this trial.,Non-interventional,No,On-Hold,06/17/2019,,,,,,University of Pennsylvania/Abramson Cancer Center,06/13/2019,Ready for Administrative QC Date,06/17/2019,Registry,2,,"Ready for Admin QCOn hold since 06/17/2019 , reason: Other",06/13/2019,,06/13/2019,06/13/2019,"Otubu, Temisan",06/13/2019,,,,,,,,,,06/17/2019,"gillh, Hannah Gill",06/17/2019,,,,06/17/2019,"Titanwa, Florence",06/17/2019,06/17/2019,"Chen, Sisi",06/17/2019,,,,,,,,,,,,,,,
2017-01737,Amendment,08/05/2019,08/19/2019,,08/05/2019,,,,,,"Appiah, Cecilia (SC)",University of Chicago Comprehensive Cancer Center,96307,NCT03223155,,,,IRB17-0547 AM015,INSTITUTIONAL,,,,,Interventional,No,Accepted,08/05/2019,,,appiahca,08/06/2019,,University of Chicago Comprehensive Cancer Center,08/05/2019,Scientific Processing Start Date,08/06/2019,Registry,2,,,08/05/2019,,08/05/2019,08/05/2019,"Gebeniene, Elena",08/05/2019,,,,,,,,,,,,,,,,,,,,,,,,,,,,,,,,,,,,
2017-02410,Amendment,08/05/2019,08/19/2019,,08/05/2019,,,,,,,Alliance for Clinical Trials in Oncology,35276867,NCT03578081,A221602,A221602,,35,NATIONAL,,,,,Interventional,No,Accepted,08/05/2019,,,,,DCP,National Cancer Institute Division of Cancer Prevention,08/05/2019,Submission Acceptance Date,08/05/2019,REST Service,2,,Ready for Admin ProcessingReady for Scientific Processing,08/05/2019,"PIO, DCP",08/05/2019,08/05/2019,"Gebeniene, Elena",08/05/2019,,,,,,,,,,,,,,,,,,,,,,,,,,,,,,,,,,,,
2019-05228,Abbreviated,07/26/2019,08/19/2019,,07/26/2019,08/02/2019,,07/26/2019,07/26/2019,,,Oregon Research Institute,38601493,NCT01341938,,,,,INDUSTRIAL,07/26/2019,08/02/2019,Other,PO Curation Request to add PI Herbert H Severson - EW # 95998,Interventional,No,Accepted,08/02/2019,,,,,,ClinicalTrials.gov,07/26/2019,Ready for Administrative QC Date,08/02/2019,ClinicalTrials.gov,2,,Ready for Admin QC,07/26/2019,"Grinberg, Viktoriya",07/26/2019,07/26/2019,"Grinberg, Viktoriya",07/26/2019,,,,,,,,,,08/02/2019,"gillh, Hannah Gill",08/02/2019,,,,07/26/2019,"Chen, Sisi",07/26/2019,07/26/2019,"Titanwa, Florence",07/26/2019,,,,,,,,,,,,,,,
2019-05449,Abbreviated,08/05/2019,08/19/2019,,08/05/2019,,,08/05/2019,08/05/2019,,,National Cancer Institute,154376,NCT04044365,,,,,INDUSTRIAL,,,,,Non-interventional,Yes,Accepted,08/05/2019,,,,,,ClinicalTrials.gov,08/05/2019,Scientific QC Completed Date,08/05/2019,ClinicalTrials.gov,2,,,08/05/2019,"sandersbj, Bobbie Jo Sanders",08/05/2019,08/05/2019,"sandersbj, Bobbie Jo Sanders",08/05/2019,,,,,,,,,,,,,,,,08/05/2019,"Chen, Sisi",08/05/2019,08/05/2019,"Titanwa, Florence",08/05/2019,,,,,,,,,,,,,,,
2019-05450,Abbreviated,08/05/2019,08/19/2019,,08/05/2019,,,08/05/2019,08/06/2019,,,Kaiser Permanente,82991,NCT00697047,,,,,INDUSTRIAL,,,,,Interventional,No,Accepted,08/05/2019,,,,,,ClinicalTrials.gov,08/05/2019,Scientific QC Completed Date,08/06/2019,ClinicalTrials.gov,2,,,08/05/2019,"Grinberg, Viktoriya",08/05/2019,08/05/2019,"Grinberg, Viktoriya",08/05/2019,,,,,,,,,,,,,,,,08/05/2019,"Chen, Sisi",08/05/2019,08/06/2019,"Titanwa, Florence",08/06/2019,,,,,,,,,,,,,,,
2019-05451,Abbreviated,08/05/2019,08/19/2019,,08/05/2019,,,08/05/2019,,,,University of Rochester,174173,NCT01238120,,,,,INDUSTRIAL,,,,,Interventional,No,Accepted,08/05/2019,,,,,,ClinicalTrials.gov,08/05/2019,Ready for Scientific QC Date,08/05/2019,ClinicalTrials.gov,2,,Ready for Scientific QC,08/05/2019,"Grinberg, Viktoriya",08/05/2019,08/05/2019,"Grinberg, Viktoriya",08/05/2019,,,,,,,,,,,,,,,,08/05/2019,"Chen, Sisi",08/05/2019,,,,,,,,,,,,,,,,,,
2019-05452,Abbreviated,08/05/2019,08/19/2019,,08/05/2019,,,,,,,Catherine Bollard,89105579,NCT01945814,,,,,INDUSTRIAL,,,,,Interventional,No,Accepted,08/05/2019,,,,,,ClinicalTrials.gov,08/05/2019,Submission Acceptance Date,08/05/2019,ClinicalTrials.gov,2,,Ready for Admin ProcessingReady for Scientific Processing,08/05/2019,"Grinberg, Viktoriya",08/05/2019,08/05/2019,"Grinberg, Viktoriya",08/05/2019,,,,,,,,,,,,,,,,,,,,,,,,,,,,,,,,,,,,
2019-05453,Abbreviated,08/05/2019,08/19/2019,,08/05/2019,,,,,,,Catherine Bollard,89105579,NCT02203903,,,,,INDUSTRIAL,,,,,Interventional,No,Accepted,08/05/2019,,,,,,ClinicalTrials.gov,08/05/2019,Submission Acceptance Date,08/05/2019,ClinicalTrials.gov,2,,Ready for Admin ProcessingReady for Scientific Processing,08/05/2019,"Grinberg, Viktoriya",08/05/2019,08/05/2019,"Grinberg, Viktoriya",08/05/2019,,,,,,,,,,,,,,,,,,,,,,,,,,,,,,,,,,,,
2019-05454,Abbreviated,08/05/2019,08/19/2019,,08/05/2019,,,,,,,University of Massachusetts Medical School,120167,NCT02265354,,,,,INDUSTRIAL,,,,,Interventional,No,Accepted,08/05/2019,,,,,,ClinicalTrials.gov,08/05/2019,Submission Acceptance Date,08/05/2019,ClinicalTrials.gov,2,,Ready for Admin ProcessingReady for Scientific Processing,08/05/2019,"Grinberg, Viktoriya",08/05/2019,08/05/2019,"Grinberg, Viktoriya",08/05/2019,,,,,,,,,,,,,,,,,,,,,,,,,,,,,,,,,,,,
2019-05455,Abbreviated,08/05/2019,08/19/2019,,08/05/2019,,,08/05/2019,,,,Cincinnati Children's Hospital Medical Center,182911,NCT02489708,,,,,INDUSTRIAL,,,,,Interventional,No,Accepted,08/05/2019,,,,,,ClinicalTrials.gov,08/05/2019,Ready for Scientific QC Date,08/05/2019,ClinicalTrials.gov,2,,Ready for Scientific QC,08/05/2019,"Grinberg, Viktoriya",08/05/2019,08/05/2019,"Grinberg, Viktoriya",08/05/2019,,,,,,,,,,,,,,,,08/05/2019,"Titanwa, Florence",08/05/2019,,,,,,,,,,,,,,,,,,
2013-01782,Amendment,08/05/2019,08/19/2019,,08/05/2019,,,,,,"Titanwa, Florence (SC)",Mayo Clinic,139137,NCT02020707,,,,Addendum 15,INSTITUTIONAL,,,,,Interventional,No,Accepted,08/05/2019,,,titanwaf,08/06/2019,,Mayo Clinic,08/05/2019,Scientific Processing Start Date,08/06/2019,,2,,,08/05/2019,,08/05/2019,08/05/2019,"Gebeniene, Elena",08/05/2019,,,,,,,,,,,,,,,,,,,,,,,,,,,,,,,,,,,,
2017-00079,Amendment,08/05/2019,08/19/2019,,08/05/2019,,,,,,"Caesar-Johnson, Samantha (SC)",Mayo Clinic,139137,NCT03021460,,,,Amendment 4,INSTITUTIONAL,,,,,Interventional,No,Accepted,08/05/2019,,,johnsoncs,08/06/2019,,Mayo Clinic,08/05/2019,Scientific Processing Start Date,08/06/2019,Registry,2,,,08/05/2019,,08/05/2019,08/05/2019,"Gebeniene, Elena",08/05/2019,,,,,,,,,,,,,,,,,,,,,,,,,,,,,,,,,,,,
2019-05456,Abbreviated,08/05/2019,08/19/2019,,08/05/2019,,,,,,,American University,90420747,NCT02522156,,,,,INDUSTRIAL,,,,,Interventional,No,Accepted,08/05/2019,,,,,,ClinicalTrials.gov,08/05/2019,Submission Acceptance Date,08/05/2019,ClinicalTrials.gov,2,,Ready for Admin ProcessingReady for Scientific Processing,08/05/2019,"Grinberg, Viktoriya",08/05/2019,08/05/2019,"Grinberg, Viktoriya",08/05/2019,,,,,,,,,,,,,,,,,,,,,,,,,,,,,,,,,,,,
2018-02108,Amendment,08/05/2019,08/19/2019,,08/05/2019,,,08/06/2019,,,,University of Chicago Comprehensive Cancer Center,96307,NCT03571321,,,,IRB17-1110 AM002,INSTITUTIONAL,,,,,Interventional,No,Accepted,08/05/2019,,,,,,University of Chicago Comprehensive Cancer Center,08/05/2019,Ready for Scientific QC Date,08/06/2019,Registry,2,,Ready for Scientific QC,08/05/2019,,08/05/2019,08/05/2019,"Gebeniene, Elena",08/05/2019,,,,,,,,,,,,,,,,08/06/2019,"Titanwa, Florence",08/06/2019,,,,,,,,,,,,,,,,,,
2019-05304,Complete,07/30/2019,08/19/2019,,08/02/2019,08/05/2019,,,,,"Flumer, Carly (SC)",Children's Hospital of Philadelphia,198744,,,,,,INSTITUTIONAL,07/30/2019,08/02/2019,Submission Incomplete,"Can you please confirm that the correct version of the protocol was provided? We received  Protocol Date:	8/14/2018; however, the protocol listed in the IRB is dated 9/25/2018.",Interventional,No,Accepted,08/02/2019,,,flumerc,08/05/2019,,University of Pennsylvania/Abramson Cancer Center,07/30/2019,Scientific Processing Start Date,08/05/2019,Registry,2,,,07/30/2019,,07/30/2019,08/02/2019,"Otubu, Temisan",08/02/2019,,,,,,,,,,08/05/2019,"such, Chun-Hui Su",08/05/2019,,,,,,,,,,,,,,,,,,,,,,,,
2019-05457,Abbreviated,08/05/2019,08/19/2019,,08/05/2019,,,,,,,Providence Portland Medical Center,193287,NCT02575404,,,,,INDUSTRIAL,,,,,Interventional,No,Accepted,08/05/2019,,,,,,ClinicalTrials.gov,08/05/2019,Submission Acceptance Date,08/05/2019,ClinicalTrials.gov,2,,Ready for Admin ProcessingReady for Scientific Processing,08/05/2019,"Grinberg, Viktoriya",08/05/2019,08/05/2019,"Grinberg, Viktoriya",08/05/2019,,,,,,,,,,,,,,,,,,,,,,,,,,,,,,,,,,,,
2017-01891,Amendment,07/30/2019,08/19/2019,,07/30/2019,,,08/05/2019,08/05/2019,,,University of Iowa/Holden Comprehensive Cancer Center,91802,NCT03273712,,,,,EXTERNALLY_PEER_REVIEWED,07/30/2019,08/02/2019,Other,"EW 96077 - This trial and NCI-2015-00861, Lead org ID - 201412770, NCT02441088 appear to be duplicates.",Interventional,No,Accepted,08/02/2019,,,,,,University of Iowa/Holden Comprehensive Cancer Center,07/30/2019,Scientific QC Completed Date,08/05/2019,Registry,2,,,07/30/2019,,07/30/2019,07/30/2019,"Otubu, Temisan",07/30/2019,,,,,,,,,,,,,,,,08/05/2019,"Caesar-Johnson, Samantha",08/05/2019,08/05/2019,"chengi, Iris Cheng",08/05/2019,,,,,,,,,,,,,,,
2019-05458,Abbreviated,08/05/2019,08/19/2019,,08/05/2019,,,08/05/2019,,,,Brown University,212961,NCT02587312,,,,,INDUSTRIAL,,,,,Interventional,No,Accepted,08/05/2019,,,,,,ClinicalTrials.gov,08/05/2019,Ready for Scientific QC Date,08/05/2019,ClinicalTrials.gov,2,,Ready for Scientific QC,08/05/2019,"Grinberg, Viktoriya",08/05/2019,08/05/2019,"Grinberg, Viktoriya",08/05/2019,,,,,,,,,,,,,,,,08/05/2019,"Titanwa, Florence",08/05/2019,,,,,,,,,,,,,,,,,,
2019-05459,Abbreviated,08/05/2019,08/19/2019,,08/05/2019,,,,,,,Polaris Health Directions,90421981,NCT02637349,,,,,INDUSTRIAL,,,,,Interventional,No,Accepted,08/05/2019,,,,,,ClinicalTrials.gov,08/05/2019,Submission Acceptance Date,08/05/2019,ClinicalTrials.gov,2,,Ready for Admin ProcessingReady for Scientific Processing,08/05/2019,"Grinberg, Viktoriya",08/05/2019,08/05/2019,"Grinberg, Viktoriya",08/05/2019,,,,,,,,,,,,,,,,,,,,,,,,,,,,,,,,,,,,
2019-05460,Abbreviated,08/05/2019,08/19/2019,,,,,,,,"margolinr, Raisa Margolin (AD)","Sensei Biotherapeutics, Inc.",90422986,NCT04034225,,,,,INDUSTRIAL,,,,,Interventional,No,Submitted,08/05/2019,margolinr,08/06/2019,,,,ClinicalTrials.gov,08/05/2019,Submission Received Date,08/05/2019,ClinicalTrials.gov,2,,Submitted -- not accepted,08/05/2019,,08/05/2019,,,,,,,,,,,,,,,,,,,,,,,,,,,,,,,,,,,,,,,
2019-05461,Complete,08/05/2019,08/19/2019,,,,,,,,,NYP/Columbia University Medical Center/Herbert Irving Comprehensive Cancer Center,170827,NCT03838692,,,,,INSTITUTIONAL,,,,,Interventional,No,Submitted,08/05/2019,,,,,,NYP/Columbia University Medical Center/Herbert Irving Comprehensive Cancer Center,08/05/2019,Submission Received Date,08/05/2019,Registry,2,,Submitted -- not accepted,08/05/2019,,08/05/2019,,,,,,,,,,,,,,,,,,,,,,,,,,,,,,,,,,,,,,,
2019-05232,Complete,07/26/2019,08/19/2019,,08/05/2019,,,,,,,Children's Hospital of Philadelphia,198744,NCT02356653,,,,,INSTITUTIONAL,07/29/2019,08/05/2019,Submission Incomplete -- Missing Documents,"Trial placed on hold because provided IRB was expired on May 17, 2017. Please provide unexpired IRB. If unexpired IRB approves new protocol and consent. Please provide it as well.",Interventional,No,Accepted,08/05/2019,,,,,,University of Pennsylvania/Abramson Cancer Center,07/26/2019,Submission Acceptance Date,08/05/2019,Registry,2,,Ready for Admin ProcessingReady for Scientific Processing,07/26/2019,,07/26/2019,08/05/2019,"such, Chun-Hui Su",08/05/2019,,,,,,,,,,,,,,,,,,,,,,,,,,,,,,,,,,,,
2019-05462,Abbreviated,08/05/2019,08/19/2019,,,,,,,,,Qilu Puget Sound Biotherapeutics (dba Sound Biologics),90423947,NCT03986606,,,,,INDUSTRIAL,,,,,Interventional,No,Submitted,08/05/2019,,,,,,ClinicalTrials.gov,08/05/2019,Submission Received Date,08/05/2019,ClinicalTrials.gov,2,,Submitted -- not accepted,08/05/2019,,08/05/2019,,,,,,,,,,,,,,,,,,,,,,,,,,,,,,,,,,,,,,,
2012-00084,Amendment,08/05/2019,08/19/2019,,,,,,,,,Rutgers Cancer Institute of New Jersey,161648,NCT01480154,8983,,CDR0000717546,8,EXTERNALLY_PEER_REVIEWED,,,,,Interventional,Yes,Amendment Submitted,08/05/2019,,,,,CTEP,Cancer Therapy Evaluation Program,08/05/2019,Submission Received Date,08/05/2019,REST Service,2,,Submitted -- not accepted,08/05/2019,"System-Account, CTEP",08/05/2019,,,,,,,,,,,,,,,,,,,,,,,,,,,,,,,,,,,,,,,
2019-05310,Complete,07/30/2019,08/19/2019,08/01/2019,07/31/2019,,,07/31/2019,08/01/2019,,,Children's Hospital of Philadelphia,198744,NCT03516799,,,,,INSTITUTIONAL,08/01/2019,,Submission Incomplete,"Hi. Can you please provide the docs listed in the IRB  - Protocol (dated September 10, 2018) and Consent Form - Main Study (dated May 17, 2018)? Thanks.",Interventional,No,On-Hold,08/01/2019,,,,,,University of Pennsylvania/Abramson Cancer Center,07/30/2019,Administrative Processing Start Date,08/01/2019,Registry,2,,"On hold since 08/01/2019 , reason: Submission Incomplete",07/30/2019,,07/30/2019,07/31/2019,"such, Chun-Hui Su",07/31/2019,,,,,,,,,,,,,,,,07/31/2019,"buchanani, Ian Buchanan",07/31/2019,08/01/2019,"Chen, Sisi",08/01/2019,,,,,,,,,,,,,,,
2019-04789,Abbreviated,07/11/2019,08/20/2019,07/12/2019,,,,,,,,Icahn School of Medicine at Mount Sinai,52665820,NCT00666549,,,,,INDUSTRIAL,07/12/2019,,Other,"Per EW# 95446, reach out to lead org ?Icahn School of Medicine at Mount Sinai? to request whether lead org would like to register the trial under complete workflow.",Non-interventional,No,On-Hold,07/12/2019,,,,,,ClinicalTrials.gov,07/11/2019,Submission Received Date,07/11/2019,ClinicalTrials.gov,2,,"Submitted -- not acceptedOn hold since 07/12/2019 , reason: Other",07/11/2019,,07/11/2019,,,,,,,,,,,,,,,,,,,,,,,,,,,,,,,,,,,,,,,
2019-05414,Complete,08/02/2019,08/20/2019,,08/05/2019,,,,,,,Wake Forest University Health Sciences,149074,NCT03998189,,,,,INSTITUTIONAL,08/02/2019,08/05/2019,Submission Incomplete -- Missing Documents,"The IRB dated 7/31/2019 list Informed Consent Version: 03219 consent 7-09-2019_clean.doc. However, the IC was not provided.  Please provide Informed Consent 7-09-2019_clean.",Interventional,No,Accepted,08/05/2019,,,,,,Wake Forest University Health Sciences,08/02/2019,Submission Acceptance Date,08/05/2019,Registry,2,,Ready for Admin ProcessingReady for Scientific Processing,08/02/2019,,08/02/2019,08/05/2019,"johnsonj, Julie Johnson",08/05/2019,,,,,,,,,,,,,,,,,,,,,,,,,,,,,,,,,,,,
2019-05329,Abbreviated,07/31/2019,08/20/2019,08/01/2019,07/31/2019,08/05/2019,,07/31/2019,08/01/2019,,,"The University of Texas Medical Branch, Galveston",89914879,NCT02255240,,,,,INDUSTRIAL,08/01/2019,,Other,"EW 96142 - PO Curation was submitted to add PI Elizabeth J Lyons, PhD. Validation error due to PI not being added to the PS.",Interventional,No,On-Hold,08/01/2019,,,,,,ClinicalTrials.gov,07/31/2019,Ready for Administrative QC Date,08/05/2019,ClinicalTrials.gov,2,,"Ready for Admin QCOn hold since 08/01/2019 , reason: Other",07/31/2019,"Grinberg, Viktoriya",07/31/2019,07/31/2019,"Grinberg, Viktoriya",07/31/2019,,,,,,,,,,08/05/2019,"Otubu, Temisan",08/05/2019,,,,07/31/2019,"chengi, Iris Cheng",07/31/2019,08/01/2019,"buchanani, Ian Buchanan",08/01/2019,,,,,,,,,,,,,,,
2019-05368,Abbreviated,08/01/2019,08/20/2019,08/02/2019,08/01/2019,,,08/02/2019,08/02/2019,,,Navidea Biopharmaceuticals,24625275,NCT03029988,,,,,INDUSTRIAL,08/02/2019,,Other,Trial placed on hold  - PO Curation Request for PI Frederick Cope ? EW # 96196.,Interventional,No,On-Hold,08/02/2019,,,,,,ClinicalTrials.gov,08/01/2019,Administrative Processing Start Date,08/02/2019,ClinicalTrials.gov,2,,"On hold since 08/02/2019 , reason: Other",08/01/2019,"Grinberg, Viktoriya",08/01/2019,08/01/2019,"Grinberg, Viktoriya",08/01/2019,,,,,,,,,,,,,,,,08/02/2019,"Titanwa, Florence",08/02/2019,08/02/2019,"chengi, Iris Cheng",08/02/2019,,,,,,,,,,,,,,,
2019-04731,Abbreviated,07/09/2019,08/20/2019,07/10/2019,,,,,,,,Mayo Clinic in Arizona,32332,NCT03634332,,,,,INDUSTRIAL,07/10/2019,,Other,"Per CT.gov, the responsible party is the Pancreatic Cancer Research Team but it is listed as Mayo Clinic in Arizona in PA. Submitted the outreach to the Engineering team (ref. EW# 95382).",Interventional,No,On-Hold,07/10/2019,,,,,,ClinicalTrials.gov,07/09/2019,Submission Received Date,07/09/2019,ClinicalTrials.gov,2,,"Submitted -- not acceptedOn hold since 07/10/2019 , reason: Other",07/09/2019,,07/09/2019,,,,,,,,,,,,,,,,,,,,,,,,,,,,,,,,,,,,,,,
2019-03637,Complete,05/30/2019,08/20/2019,05/31/2019,,,,,,,,Montefiore Medical Center-Weiler Hospital,171322,NCT03574818,,,,,INSTITUTIONAL,05/31/2019,,Other,"Per EW# 93999 trial has been placed on hold, asked if the newer protocol version is available. The Protocol V1.1 provided has the IRB Expiration Date 10/10/2018. The submitter was notified via email.",Interventional,No,On-Hold,05/31/2019,,,,,,Montefiore Medical Center-Weiler Hospital,05/30/2019,Submission Received Date,05/30/2019,Registry,2,,"Submitted -- not acceptedOn hold since 05/31/2019 , reason: Other",05/30/2019,,05/30/2019,,,,,,,,,,,,,,,,,,,,,,,,,,,,,,,,,,,,,,,
2019-05372,Complete,08/01/2019,08/20/2019,08/02/2019,,,,,,,,Fred Hutch/University of Washington Cancer Consortium,39492311,,,,,,INSTITUTIONAL,08/02/2019,,Submission Incomplete,"Hi. When I opened the protocol doc, it said \"The protocol size is too big to be uploaded. Protocol will be sent to  ncictro@mail.nih.gov.\" Can you please provide the protocol? Thanks.",Interventional,No,On-Hold,08/02/2019,,,,,,Fred Hutch/University of Washington Cancer Consortium,08/01/2019,Submission Received Date,08/01/2019,Registry,2,,"Submitted -- not acceptedOn hold since 08/02/2019 , reason: Submission Incomplete",08/01/2019,,08/01/2019,,,,,,,,,,,,,,,,,,,,,,,,,,,,,,,,,,,,,,,
2017-01827,Amendment,08/02/2019,08/20/2019,08/05/2019,,,,,,,,University of California Davis Comprehensive Cancer Center,41545,NCT03359460,,,,,INSTITUTIONAL,08/05/2019,,Submission Incomplete -- Missing Documents,Placing trial on hold because tracked protocol and consent form are not provided. Please provide a tracked protocol or summary of changes (protocol) and consent form (file name: UCDCC#265_Consent_05.02.19_clean).,Interventional,No,On-Hold,08/05/2019,,,,,,University of California Davis Comprehensive Cancer Center,08/02/2019,Submission Received Date,08/02/2019,Registry,2,,"Submitted -- not acceptedOn hold since 08/05/2019 , reason: Submission Incomplete -- Missing Documents",08/02/2019,,08/02/2019,,,,,,,,,,,,,,,,,,,,,,,,,,,,,,,,,,,,,,,
2019-05309,Complete,07/30/2019,08/20/2019,07/31/2019,,,,,,,,Children's Hospital of Philadelphia,198744,,,,,,INSTITUTIONAL,07/31/2019,,Submission Incomplete -- Missing Documents,"Trial placed on hold because provided IRB was expired on 10/25/2017. Please provide the most recent IRB approval. If newer IRB approval approves more recent protocol/consent version, please provide it as well.",Non-interventional,No,On-Hold,07/31/2019,,,,,,University of Pennsylvania/Abramson Cancer Center,07/30/2019,Submission Received Date,07/30/2019,Registry,2,,"Submitted -- not acceptedOn hold since 07/31/2019 , reason: Submission Incomplete -- Missing Documents",07/30/2019,,07/30/2019,,,,,,,,,,,,,,,,,,,,,,,,,,,,,,,,,,,,,,,
2019-05349,Complete,08/01/2019,08/21/2019,08/01/2019,,,,,,,,Children's Hospital of Philadelphia,198744,NCT02906371,,,,,INSTITUTIONAL,08/01/2019,,Submission Incomplete -- Missing Documents,"Per the current IRB approval dated 06/28/2019 the current protocol is version dated 09/10/2017; however protocol version dated 08/02/2016 was provided. Please provide the current protocol version dated 09/08/2017 that lists the current PI. Also, the current IRB approval states that the current consent forms are dated  04/24/2019 and 10/20/2017 - please provide these consents as well",Interventional,No,On-Hold,08/01/2019,,,,,,University of Pennsylvania/Abramson Cancer Center,08/01/2019,Submission Received Date,08/01/2019,Registry,2,,"Submitted -- not acceptedOn hold since 08/01/2019 , reason: Submission Incomplete -- Missing Documents",08/01/2019,,08/01/2019,,,,,,,,,,,,,,,,,,,,,,,,,,,,,,,,,,,,,,,
2019-05382,Complete,08/02/2019,08/21/2019,08/02/2019,,,,,,,,University of Pennsylvania/Abramson Cancer Center,198713,NCT03781960,,,,,INSTITUTIONAL,08/02/2019,,Submission Incomplete,Can you please provide _ICF-HIPAA_2018-12-17 clean? Thanks.,Interventional,No,On-Hold,08/02/2019,,,,,,University of Pennsylvania/Abramson Cancer Center,08/02/2019,Submission Received Date,08/02/2019,Registry,2,,"Submitted -- not acceptedOn hold since 08/02/2019 , reason: Submission Incomplete",08/02/2019,,08/02/2019,,,,,,,,,,,,,,,,,,,,,,,,,,,,,,,,,,,,,,,
2017-00208,Amendment,08/05/2019,08/21/2019,08/05/2019,,,,,,,,Childrens Oncology Group,60948,NCT03057054,ACCL1633,COG-ACCL1633,,30,NATIONAL,08/05/2019,,Other,"Per EW# 96261, reach DCP PIO to confirm whether current submission should be rejected or processed because complete sheet indicates protocol (version date: 05/09/2019) was disapproved.",Interventional,No,On-Hold,08/05/2019,,,,,DCP,National Cancer Institute Division of Cancer Prevention,08/05/2019,Submission Received Date,08/05/2019,REST Service,2,2018-03-16 C. Yaghmour manually copied the DCP ID into the CTEP ID field per ticket https://fnlcr.teamwork.com/desk/#/tickets/871370.,"Submitted -- not acceptedOn hold since 08/05/2019 , reason: Other",08/05/2019,"PIO, DCP",08/05/2019,,,,,,,,,,,,,,,,,,,,,,,,,,,,,,,,,,,,,,,
2019-05352,Complete,08/01/2019,08/21/2019,08/01/2019,08/01/2019,,,,,,,Children's Hospital of Philadelphia,198744,,,,,,INSTITUTIONAL,08/01/2019,,Submission Incomplete -- Missing Documents,"Per the current IRB approval provided dated 07/03/2019 the current protocol is version dated 10/08/2018; however, protocol version 07/21/2017 was provided. Please provide the current protocol version dated 10/08/2018. Also, per the current IRB approval the current consent form is dated 09/14/2018. Please provide this consent form as well",Interventional,No,On-Hold,08/01/2019,,,,,,University of Pennsylvania/Abramson Cancer Center,08/01/2019,Submission Acceptance Date,08/01/2019,Registry,2,,"Ready for Admin ProcessingReady for Scientific ProcessingOn hold since 08/01/2019 , reason: Submission Incomplete -- Missing Documents",08/01/2019,,08/01/2019,08/01/2019,"gillh, Hannah Gill",08/01/2019,,,,,,,,,,,,,,,,,,,,,,,,,,,,,,,,,,,,
2019-05353,Complete,08/01/2019,08/21/2019,08/01/2019,,,,,,,,Children's Hospital of Philadelphia,198744,,,,,,INSTITUTIONAL,08/01/2019,,Submission Incomplete -- Missing Documents,Per the current IRB approval dated 04/02/2019 the current protocol is version dated 10/09/2018; however protocol version dated 03/16/2018 was provided. Please provide the current protocol version dated 10/09/2018,Interventional,No,On-Hold,08/01/2019,,,,,,University of Pennsylvania/Abramson Cancer Center,08/01/2019,Submission Received Date,08/01/2019,Registry,2,,"Submitted -- not acceptedOn hold since 08/01/2019 , reason: Submission Incomplete -- Missing Documents",08/01/2019,,08/01/2019,,,,,,,,,,,,,,,,,,,,,,,,,,,,,,,,,,,,,,,
